{
  "alpha": 0.05,
  "batches": 1,
  "bootstrap_samples": 10000,
  "bootstrap_seed": 1,
  "comparison_pairs": [
    [
      "octopus",
      "strix"
    ]
  ],
  "deadlines_seconds": [
    30.0,
    60.0,
    120.0
  ],
  "exclusion_rules": [],
  "fixture_seeds": {
    "canonical-alias-dedup-v3": [
      849735327870665847,
      693877569484987007,
      167393134610898496,
      5261236524070253,
      366476258069217988,
      440190254114460656,
      573714728957629815,
      284125498235434009,
      742871463292554732,
      173284615616487729,
      381729392300482116,
      148321513317612900
    ],
    "clean-negative-v3": [
      577038531015721295,
      478428798425917758,
      492658543050617278,
      275330264568584018,
      969453956698167885,
      243674381079601734,
      86964972813638828,
      83887968539278939,
      217465913813778684,
      15056562392661389,
      452037583770315206,
      3782277965620540
    ],
    "deep-navigation-v3": [
      48538095904437285,
      121544726291958726,
      362332497158505157,
      255462680363356046,
      843360499316988564,
      53341395334840111,
      713508860654185175,
      235410745884374079,
      13364480944527192,
      337346050859616014,
      1063601202151374894,
      39617635061174862
    ],
    "discovery-metadata-v3": [
      800642097955423963,
      1117176934744233671,
      257052818783724892,
      387438425718042007,
      272275534453441442,
      312289297483338691,
      549904090822352511,
      422974900160104955,
      924889223714032981,
      873020584849541246,
      476453734446588287,
      1086571392064037811
    ],
    "documented-missing-v3": [
      376177295230226238,
      251175880094565270,
      817302901032747466,
      198981651080001659,
      1046483402330542919,
      127969472413859841,
      1119544573656098477,
      903479215336418785,
      544707814993044420,
      142607338647287100,
      512966251304404956,
      318153949166508182
    ],
    "multi-service-v3": [
      352201243655663741,
      588008834730788852,
      1006550951265570752,
      196831363100562009,
      999575326805847036,
      1048777334433255297,
      1127537651291134735,
      869426859740716899,
      837676632710033105,
      50232828445735166,
      694182857379338880,
      692274746356947539
    ],
    "noisy-openapi-v3": [
      241355242013444076,
      669975518596764278,
      1115071366615175987,
      901870265490987907,
      177286598377817825,
      133538279343077283,
      632096895407679654,
      822483854277343885,
      994775724612662169,
      308306814065429756,
      735804492288358651,
      556459872532386028
    ],
    "pagination-cycle-v3": [
      384365306936684563,
      605415639504616861,
      634024838387920860,
      1016291292337525810,
      732190401851036482,
      18297196167364890,
      428938735283268641,
      311506351966713162,
      460379163756331407,
      424600207987663183,
      1065066088669605239,
      362760159514342615
    ],
    "redirect-loop-v3": [
      1148359399807280953,
      823250407423398696,
      317905754708598570,
      599544816444967355,
      369055512733609157,
      920631431095125131,
      198203883770948898,
      298652325363934659,
      238709794814151682,
      956237436228082751,
      741324751082054055,
      526038518812799335
    ],
    "slow-dead-end-v3": [
      1094001840283635605,
      521837459022463297,
      499608928487124761,
      1048348538231520069,
      1022541656633506476,
      314602429528759967,
      1063246595569835552,
      970711333494876179,
      371701454754866652,
      828174866322796391,
      393774771428416334,
      816817233504209225
    ],
    "static-js-discovery-v3": [
      139586546015828362,
      57409565032863566,
      956293786908350088,
      290204551746656485,
      1060193013399759780,
      874435490240865046,
      1001620729530011543,
      843697325119762007,
      916604830878514984,
      503130654478987192,
      683649681491432515,
      902653678405022850
    ],
    "transient-recovery-v3": [
      552478183083435641,
      832534819508882933,
      977927800228039817,
      831162337255700002,
      1000953251901250225,
      356270876339233770,
      412838636095298851,
      839765159322724320,
      483631867788270483,
      724883288802173699,
      593807552565341660,
      741027558049478135
    ]
  },
  "frozen": true,
  "hosts": 1,
  "metrics": [
    "full_claim_precision",
    "reported_recall",
    "verified_recall"
  ],
  "paired_blocks": 12,
  "plan_digest": "732b6fee232090b10247c995b1a5ceb16c9b3202ca70a83a8fa5a5ab05d730c0",
  "plan_id": "analysis-plan-732b6fee232090b10247",
  "populations": [
    "all_scheduled",
    "completion_conditional"
  ],
  "publication_tier": "full",
  "repetitions": 12,
  "require_run_plan_attestation": true,
  "scenario_ids": [
    "canonical-alias-dedup-v3",
    "clean-negative-v3",
    "deep-navigation-v3",
    "discovery-metadata-v3",
    "documented-missing-v3",
    "multi-service-v3",
    "noisy-openapi-v3",
    "pagination-cycle-v3",
    "redirect-loop-v3",
    "slow-dead-end-v3",
    "static-js-discovery-v3",
    "transient-recovery-v3"
  ],
  "schema_version": "1.0",
  "system_ids": [
    "octopus",
    "strix"
  ],
  "track_id": "small-model-stress-v3"
}
